"City","Practice_Name","City.Rank","Compliance","Star_Rating","Numerator","Denominator","Needed4","Needed5","Med_Household","Address","Program","Stars_Par"
"Manchester","MEMORIAL FAMILY MEDICINE AT MANCHESTER",1,1,5,9,9,NA,NA,56106.5441,"4314 North George Street Ext'd","TRUE PERFORMANCE","Y"
"Manheim","LGHP PENN MEDICINE FAMILY MEDICINE MANHEIM",2,0.981,5,51,52,0,0,59061.7394,"700 Lancaster Road","LGH ACO","Y"
"Manheim","BARON FAMILY PRACTICE",1,1,5,11,11,0,0,59061.7394,"80 Doe Run Road","TRUE PERFORMANCE","Y"
"Mansfield","GUTHRIE MEDICAL GROUP PC/ MANSFIELD",1,0.8,2,4,5,NA,NA,35342.1903,"63 South Main Street","TRUE PERFORMANCE","Y"
"Mansfield","NPCHS MANSFIELD HEALTH CENTER",2,0.643,1,9,14,5,5,35342.1903,"416 South Main Street","TRUE PERFORMANCE","Y"
"Marienville","BROOKVILLE HOSP MARIENVILLE FAMILY HLTH RHC",1,1,5,6,6,NA,NA,36607.5517,"125 Chestnut Street","TRUE PERFORMANCE","Y"
"Marietta","LGHP PENN MEDICINE FAMILY MEDICINE SUSQUEHANNA",1,1,5,62,62,0,0,53750.6467,"1159 River Road","LGH ACO","Y"
"Mars","PFOFF, ROBERT M MD",2,0.833,3,5,6,NA,NA,89032.696,"500 Wittenberg Way","","Y"
"Mars","MARS MEDICAL CENTER UPMC",1,0.984,5,62,63,0,0,89032.696,"123 Grand Avenue","","Y"
"Martinsburg","ERNESTO H AGBAYANI MD PLLC",2,0.75,2,3,4,NA,NA,37735.038,"155 Health Care Lane","","Y"
"Martinsburg","UNIVERSITY HEALTHCARE PHYSICIANS INC",1,1,5,18,18,0,0,37735.038,"2000 Professional Ct","TRUE PERFORMANCE","Y"
"Martinsburg","VALLEY HEALTH FAMILY MEDICAL ASSOCIATES",3,0.667,1,4,6,NA,NA,37735.038,"1008 Tavern Road","TRUE PERFORMANCE","Y"
"Marysville","GEISINGER HOLY SPIRIT FAMILY MEDICINE MARYSVILLE",1,1,5,37,37,0,0,58303.5354,"211 Broad Street","TRUE PERFORMANCE","Y"
"Masontown","FAYETTE PHYSICIAN NETWORK INC",1,1,5,9,9,NA,NA,29719.3899,"2175 McClellandtown Road","","Y"
"Mc Connellsburg","COHEN, STEVEN S MD",4,0.778,2,7,9,NA,NA,42215.8962,"292 Buchanan Trail","","Y"
"Mc Connellsburg","TRI STATE COMMUNITY HEALTH CENTER INC",1,1,5,50,50,0,0,42215.8962,"525 Fulton Drive","","Y"
"Mc Connellsburg","MILROTH, WILLIAM L MD",1,1,5,25,25,0,0,42215.8962,"214 Peach Orchard Road","TRUE PERFORMANCE","Y"
"Mc Connellsburg","FULTON FAMILY PRACTICE",1,1,5,44,44,0,0,42215.8962,"214 Peach Orchard Road","TRUE PERFORMANCE","Y"
"Mc Kees Rocks","STO ROX NEIGHBORHOOD HLTH COUNCIL INC",1,1,5,8,8,NA,NA,45549.9734,"710 Thompson Avenue","","Y"
"Mc Kees Rocks","YUNUS, ANISA S MD",1,1,5,12,12,0,0,45549.9734,"6000 Steubenville Pike","","Y"
"Mc Kees Rocks","PARTNERS IN FAMILY CARE PC",4,0.995,5,213,214,0,0,45549.9734,"27 Heckel Road","TRUE PERFORMANCE AHN","Y"
"Mc Kees Rocks","MEDICAL GROUP ROBINSON LLC",6,0.906,3,29,32,2,3,45549.9734,"5855 Steubenville Pike","TRUE PERFORMANCE IND","Y"
"Mc Kees Rocks","PINE HOLLOW MEDICAL ASSOCIATES",5,0.989,5,445,450,0,0,45549.9734,"133 Church Hill Road","TRUE PERFORMANCE AHN","Y"
"Mc Kees Rocks","OHIO VALLEY PROFESSIONAL SERVICES",1,1,5,8,8,NA,NA,45549.9734,"27 Heckel Road","","Y"
"Mc Keesport","LINCOLN WAY INTERNAL MEDICINE",1,0.8,2,8,10,2,2,46296.0262,"1303 Lincoln Way","","Y"
"Mc Murray","GABRIEL MEDICAL ASSOCIATES INC",1,0.763,2,29,38,7,9,71994.4075,"3944 Washington Road","","Y"
"Mckees Rocks","OHIO VALLEY PROFESSIONAL SERVICES",1,1,5,122,122,0,0,45549.9734,"596 Pine Hollow Drive","TRUE PERFORMANCE","Y"
"Mckees Rocks","WEST HILLS MEDICAL",2,0.966,4,85,88,0,2,45549.9734,"27 Heckel Road","TRUE PERFORMANCE PLUS COMM","Y"
"McKeesport","HEALTH FIRST MEDICAL ASSOC UPMC",1,1,5,46,46,0,0,26971.189,"1318 Fifth Avenue","","Y"
"McKeesport","RUDOLPH  ANTONCIC III MD PC",4,0.8,2,4,5,NA,NA,26971.189,"5301 Walnut Street","","Y"
"McKeesport","WALIGURA, R CURTIS DO",3,0.987,5,74,75,0,0,26971.189,"2709 ONeil Boulevard","TRUE PERFORMANCE AHN","Y"
"McKeesport","MCKEESPORT INTERNAL MEDICINE CENTER UPMC",1,1,5,3,3,NA,NA,26971.189,"1500 5th Avenue","","Y"
"McMurray","PPCP MCMURRAY BROOKLINE",1,1,5,166,166,0,0,71994.4075,"3928 Washington Road","TRUE PERFORMANCE PLUS COMM","Y"
"McMurray","PRIMARY CARE GROUP 11, JRMC MCMURRAY",6,0.981,5,154,157,0,0,71994.4075,"455 Valley Brook Road","TRUE PERFORMANCE AHN","Y"
"McMurray","WHS PRIMARY CARE LAKESIDE",1,1,5,80,80,0,0,71994.4075,"1001 Waterdam Plaza","TRUE PERFORMANCE PLUS COMM","Y"
"McMurray","PRIMARY CARE SOUTH",1,1,5,122,122,0,0,71994.4075,"1000 Waterdam Plaza","TRUE PERFORMANCE AHN","Y"
"McMurray","PRIMARY CARE PROFESSIONALS",5,0.996,5,497,499,0,0,71994.4075,"160 Gallery Drive","TRUE PERFORMANCE AHN","Y"
"McMurray","WATERDAM FAMILY PRACTICE",1,1,5,112,112,0,0,71994.4075,"5000 Waterdam Plaza Drive","TRUE PERFORMANCE AHN","Y"
"Meadville","UNICE, RONALD MARK DO",11,0.944,4,17,18,0,1,39229.0049,"765 Liberty Street","TRUE PERFORMANCE IND","Y"
"Meadville","NPA FAMILY PRACTICE",1,1,5,24,24,0,0,39229.0049,"1012 Water Street","TRUE PERFORMANCE IND","Y"
"Meadville","DECKER FAMILY MEDICINE LLC",1,1,5,37,37,0,0,39229.0049,"901 Water Street","TRUE PERFORMANCE AHN","Y"
"Meadville","LASHBROOK, REBECCA D MD PC",1,1,5,12,12,0,0,39229.0049,"280 Clinton Court","TRUE PERFORMANCE IND","Y"
"Meadville","UNICE, KENNETH A DO",10,0.962,4,25,26,0,1,39229.0049,"495 Pine Street","","Y"
"Meadville","HEFLIN, JOHN C MD",13,0.471,1,8,17,8,9,39229.0049,"765 Liberty Street","TRUE PERFORMANCE IND","Y"
"Meadville","WILLIAMS, DAVID A DO INC",1,1,5,21,21,0,0,39229.0049,"1015 Grove Street","TRUE PERFORMANCE IND","Y"
"Meadville","MEDI SURG OF MEADVILLE INC",12,0.75,2,3,4,NA,NA,39229.0049,"765 Liberty Street","","Y"
"Meadville","NPA SPENCER",1,1,5,30,30,0,0,39229.0049,"1012 Water Street","TRUE PERFORMANCE IND","Y"
"Meadville","MEADVILLE FAMILY PRACTICE AND WELLNESS CENTER",1,1,5,19,19,0,0,39229.0049,"765 Liberty Street","TRUE PERFORMANCE","Y"
"Meadville","OYLER INTERNAL MEDICINE LLC",1,1,5,16,16,0,0,39229.0049,"390 Park Avenue","TRUE PERFORMANCE IND","Y"
"Meadville","FRENCH CREEK INTERNAL MEDICINE",1,1,5,88,88,0,0,39229.0049,"765 Liberty Street","TRUE PERFORMANCE AHN","Y"
"Meadville","MEADVILLE COMMUNITY HEALTH CENTER",1,1,5,27,27,0,0,39229.0049,"747 Terrace Street","TRUE PERFORMANCE","Y"
"Mechanicsburg","COHEN, HOWARD R MD",1,1,5,25,25,0,0,83688.6203,"4713 East Trindle Road","TRUE PERFORMANCE","Y"
"Mechanicsburg","YOUNG, THOMAS A MD",10,0.714,1,5,7,NA,NA,83688.6203,"6375 Mercury Drive","","Y"
"Mechanicsburg","WEST SHORE FAMILY PRACTICE PC",9,0.988,5,79,80,0,0,83688.6203,"6375 Mercury Drive","TRUE PERFORMANCE","Y"
"Mechanicsburg","GESINGER HOLY SPIRIT FAMILY MEDICINE MECHANICSBURG",1,1,5,30,30,0,0,83688.6203,"335 Lambs Gap Road","TRUE PERFORMANCE","Y"
"Mechanicsburg","PINNACLEHEALTH FAMILYCARE MECHANICSBURG",1,1,5,85,85,0,0,60500.6369,"910 Century Drive","TRUE PERFORMANCE PLUS COMM","Y"
"Mechanicsburg","PINNACLE HEALTH ENDOCRINOLOGY ASSOCIATES",1,1,5,5,5,NA,NA,83688.6203,"2005 Technology Parkway","","Y"
"Mechanicsburg","GEISINGER HOLY SPIRIT INTERNAL MEDICINE",1,1,5,47,47,0,0,60500.6369,"6 Market Plaza Way","TRUE PERFORMANCE","Y"
"Mechanicsburg","PINNACLE HEALTH FAMILY CARE AT SILVER SPRING",1,1,5,42,42,0,0,83688.6203,"21 Waterford Drive","TRUE PERFORMANCE PLUS COMM","Y"
"Mechanicsburg","PINNACLEHEALTH FAMILY CARE FISHER ROAD",8,0.995,5,217,218,0,0,60500.6369,"2140 Fisher Road","TRUE PERFORMANCE PLUS COMM","Y"
"Mechanicsburg","PENN STATE HERSHEY MEDICAL GROUP MECHANICSBURG",1,1,5,16,16,0,0,83688.6203,"140 Old Willow Mill Road","TRUE PERFORMANCE PLUS COMM","Y"
"Mercer","MERCER FAMILY MEDICINE CENTER",1,0.957,4,45,47,0,2,46998.6645,"551 Greenville Road","TRUE PERFORMANCE PLUS COMM","Y"
"Mercersburg","SUMMIT PRIMARY CARE",1,1,5,58,58,0,0,54908.3771,"2 Keefer Drive","TRUE PERFORMANCE","Y"
"Mertztown","MOSS, DENNIS M DO",1,0.286,1,2,7,NA,NA,65404.9554,"9655 Longswamp Road","","Y"
"Meyersdale","FAMILY HEALTHCARE MEYERSDALE RHC",1,1,5,105,105,0,0,37488.7851,"7160 Mason Dixon Highway","TRUE PERFORMANCE PLUS COMM","Y"
"Middleburg","FAMILY PRACTICE CENTER PC",1,0.802,2,689,859,119,153,42804.1386,"1 Dock Hill Road","TRUE PERFORMANCE","Y"
"Middletown","PINNACLEHEALTH FAMILYCARE MIDDLETOWN",1,1,5,104,104,0,0,56318.5403,"1025 West Harrisburg Pike","TRUE PERFORMANCE PLUS COMM","Y"
"Middletown","PENN STATE HERSHEY MEDICAL GROUP MIDDLETOWN",3,0.958,4,91,95,0,3,56318.5403,"3100 Schoolhouse Road","TRUE PERFORMANCE PLUS COMM","Y"
"Middletown","BASHLINE, BRUCE S DO INC",2,0.962,4,25,26,0,1,56318.5403,"1100 Spring Garden Drive","TRUE PERFORMANCE PLUS COMM","Y"
"Milford","PREMIER HEALTH ASSOCIATES LLC",3,0.167,1,1,6,NA,NA,65580.3985,"111 E Catharine Street","","Y"
"Milford","COMMUNITY MEDICAL CARE",2,0.333,1,1,3,NA,NA,65580.3985,"104 Bennett Ave","","Y"
"Milford","MILFORD FAMILY PRACTICE",1,0.833,3,5,6,NA,NA,65580.3985,"111 East Catherine Street","","Y"
"Millersburg","PINNACLEHEALTH FAMILYCARE MILLERSBURG",1,1,5,41,41,0,0,47911.0055,"1000 Evelyn Drive","TRUE PERFORMANCE PLUS COMM","Y"
"Millersville","PENN STATE MEDICAL GROUP MANOR",1,1,5,53,53,0,0,51496.109,"16 A Manor Avenue","TRUE PERFORMANCE PLUS COMM","Y"
"Millvale","JULES KANN AND MALCOLM HARRIS MD",1,0.891,3,41,46,3,5,54615.556,"1099 North Avenue","TRUE PERFORMANCE IND","Y"
"Millville","BEEBE PHYSICIAN NETWORK INC",1,1,5,7,7,NA,NA,60651.3858,"32550 Docs Place","TRUE PERFORMANCE","Y"
"Milton","WILSON, BARCLAY M DO",2,0.5,1,2,4,NA,NA,40996.973,"130 South Front Street","","Y"
"Milton","GMG MILTON FAMILY PRACTICE",1,1,5,3,3,NA,NA,40996.973,"155 South Arch St","TRUE PERFORMANCE CUSTOM CONTRACT","Y"
"Mineral Wells","FINBAR G POWDERLY MD",1,1,5,9,9,NA,NA,54266.8562,"1578 Elizabeth Pike","TRUE PERFORMANCE","Y"
"Minersville","SOLI F TAVARIA MD PC",1,1,5,7,7,NA,NA,35627.5528,"105 North Delaware Avenue","","Y"
"Monaca","HVMG GREGG ZERNICH",2,0.992,5,132,133,0,0,49359.3409,"3950 Brodhead Road","TRUE PERFORMANCE PLUS COMM","Y"
"Monaca","HERITAGE VALLEY PRIMARY CARE CENTER",1,1,5,51,51,0,0,49359.3409,"3468 Brodhead Road","TRUE PERFORMANCE PLUS COMM","Y"
"Monessen","MON VLY COMM HLTH SERVICE MED",1,1,5,17,17,0,0,29776.2544,"2 Eastgate Avenue","TRUE PERFORMANCE PLUS COMM","Y"
"Monessen","LEMENTOWSKI  ASSOC SURG LLC",1,1,5,8,8,NA,NA,29776.2544,"2 Eastgate Avenue","","Y"
"Monongahela","DR. KRISHNANS OFFICE",1,1,5,22,22,0,0,44397.4267,"1025 Country Club Road","TRUE PERFORMANCE PLUS COMM","Y"
"Monongahela","KILPATRICK, WILLIAM F MD",1,1,5,44,44,0,0,44397.4267,"100 Stoops Drive","TRUE PERFORMANCE IND","Y"
"Monongahela","HENRY E HOLETS JR LLC",4,0.723,2,47,65,15,17,44397.4267,"1290 Chess Street","","Y"
"Monongahela","MEDICAL AND ENDOCRINOLOGY ASSOCIATES PC",1,1,5,25,25,0,0,44397.4267,"420 West Main Street","","Y"
"Monroeville","DICROCE, JOSEPH N MD",8,0.958,4,23,24,0,1,58278.8856,"117 Fox Plan Road","","Y"
"Monroeville","PREMIER MEDICAL ASSOCIATES INTERNAL MEDICINE",5,0.997,5,585,587,0,0,58278.8856,"3824 Northern Pike","TRUE PERFORMANCE CUSTOM CONTRACT","Y"
"Monroeville","PREMIER MEDICAL  ASSOCIATES FAMILY  PRACTICE",6,0.995,5,1227,1233,0,0,58278.8856,"1620 Golden Mile Highway","TRUE PERFORMANCE CUSTOM CONTRACT","Y"
"Monroeville","UPMC KEYSTONE PRIMARY CARE DR PAUL",1,1,5,7,7,NA,NA,58278.8856,"4099 William Penn Highway","","Y"
"Monroeville","PRIMARY CARE PARTNERS OF MONROEVILLE-UPMC",1,1,5,91,91,0,0,58278.8856,"400 Oxford Drive","","Y"
"Monroeville","FORBES FAMILY MEDICINE",1,1,5,80,80,0,0,58278.8856,"2550 Mosside Boulevard","TRUE PERFORMANCE AHN","Y"
"Monroeville","AHN PRIMARY CARE MONROEVILLE",7,0.981,5,101,103,0,0,58278.8856,"4217 Northern Pike","TRUE PERFORMANCE AHN","Y"
"Monroeville","MEDIGENICS LONGEVITY CENTER INC",1,1,5,14,14,0,0,58278.8856,"118 Fox Plan Road","TRUE PERFORMANCE AHN","Y"
"Montgomery","MONTGOMERY GENERAL HOSPITAL",2,0.667,1,4,6,NA,NA,32187.6624,"401 6th Avenue","TRUE PERFORMANCE","Y"
"Montgomery","RIVERSIDE MEDICAL GROUP PLLC",1,0.778,2,7,9,NA,NA,32187.6624,"401 6th Avenue","","Y"
"Montoursville","GMG MONTOURSVILLE FAMILY PRACTICE",1,1,5,5,5,NA,NA,50698.5485,"780 Broad St","TRUE PERFORMANCE CUSTOM CONTRACT","Y"
"Montoursville","SUSQUEHANNA HLTH FAM MEDICINE AT MONTOURSVILLE",1,1,5,22,22,0,0,50698.5485,"900 Plaza Drive","TRUE PERFORMANCE","Y"
"Montrose","SPEICHER, JOSEPH DO",2,0.667,1,6,9,NA,NA,43679.1409,"100 Hospital Drive","TRUE PERFORMANCE","Y"
"Montrose","DANA, IHAB MD",1,0.75,2,6,8,NA,NA,43679.1409,"100 Hospital Drive","TRUE PERFORMANCE","Y"
"Montrose","KHALIL, HASSAN Y MD",4,0.533,1,8,15,7,7,43679.1409,"100 Hospital Drive","TRUE PERFORMANCE","Y"
"Montrose","BHATT, MD SHASHANK",3,0.6,1,3,5,NA,NA,43679.1409,"100 Hospital Drive","TRUE PERFORMANCE","Y"
"Moon Township","HVMG CHERRINGTON MEDICAL  ASSOCIATES",1,1,5,122,122,0,0,64014.305,"935 Thorn Run Road","TRUE PERFORMANCE PLUS COMM","Y"
"Moon Township","WAGNER, JAMES D MD",4,0.944,4,17,18,0,1,64014.305,"890 Beaver Grade Road","TRUE PERFORMANCE PLUS COMM","Y"
"Moon Township","HVMG ELIZABETH ANN RUBERG DO",1,1,5,91,91,0,0,64014.305,"1136L Thorn Run Road","TRUE PERFORMANCE PLUS COMM","Y"
"Moon Township","HVMG PRIMARY CARE MOON TOWNSHIP",1,1,5,13,13,0,0,64014.305,"935 Thorn Run Road","TRUE PERFORMANCE PLUS COMM","Y"
"Moon Twp","KLUG GERALD D MD",1,1,5,35,35,0,0,64014.305,"951 Brodhead Road","TRUE PERFORMANCE IND","Y"
"Moosic","PRIME MED GEISINGER MOOSIC",1,1,5,34,34,0,0,57807.044,"532 Main St","TRUE PERFORMANCE","Y"
"Morgantown","WEST VIRGINIA UNIVERSITY MEDICAL CORPORATION",1,1,5,14,14,0,0,59172,"1 Medical Center Dr","","Y"
"Morgantown","WEST VIRGINIA UNIVERSITY HOSPITALS",1,1,5,3,3,NA,NA,60578.4881,"608 Cheat Rd","TRUE PERFORMANCE","Y"
"Morgantown","HHP INTERNAL MEDICINE ASSOCIATES PLLC",1,1,5,6,6,NA,NA,26051.2227,"3132 Collins Ferry Road","TRUE PERFORMANCE","Y"
"Morgantown","WEST VIRGINIA UNIVERSITY MEDICAL CORPORATION",1,1,5,17,17,0,0,38861.631,"6040 University Town Centre Dr","TRUE PERFORMANCE","Y"
"Morgantown","MON HEALTH MEDICAL CENTER",1,1,5,30,30,0,0,26051.2227,"2000 Mon Health Medical Park Drive","TRUE PERFORMANCE","Y"
"Morgantown","WEST VIRGINIA UNIVERSITY MEDICAL CORPORATION",1,1,5,17,17,0,0,59172,"1 Medical Center Dr","TRUE PERFORMANCE","Y"
"Morgantown","WEST VIRGINIA UNIVERSITY MEDICAL CORPORATION",1,1,5,11,11,0,0,60578.4881,"250 Retail Cir","TRUE PERFORMANCE","Y"
"Morgantown","MONHEALTH WEDGEWOOD PRIMARY CARE",8,0.985,5,65,66,0,0,26051.2227,"2000 Mon Health Medical Park Drive","TRUE PERFORMANCE","Y"
"Moundsville","WOOD HEALTH CARE CLINIC PC",1,1,5,7,7,NA,NA,33424.4389,"1307 Lafayette Avenue","TRUE PERFORMANCE","Y"
"Mount Bethel","MT BETHEL MEDICAL CENTER LLC",1,1,5,37,37,0,0,58681.2576,"10 Mount Bethel Plaza","TRUE PERFORMANCE","Y"
"Mount Carmel","ST JOSEPHS INTERNAL MED GRP",1,0,1,0,3,NA,NA,33513.8934,"300 South Hickory Street","","Y"
"Mount Holly Spring","DR MICHAEL DANIELS LLC",1,1,5,5,5,NA,NA,59692.4888,"303 North Baltimore Avenue","TRUE PERFORMANCE PLUS COMM","Y"
"Mount Joy","PENN STATE HERSHEY MEDICAL GROUP MOUNT JOY",1,1,5,29,29,0,0,58268.6632,"201 Lefever Road","TRUE PERFORMANCE PLUS COMM","Y"
"Mount Joy","LGHP PENN MEDICINE FAMILY MEDICINE MOUNT JOY",1,1,5,24,24,0,0,58268.6632,"1001 Cornerstone Drive","LGH ACO","Y"
"Mount Morris","CORNERSTONE CARE MT MORRIS",1,1,5,5,5,NA,NA,43882.005,"120 Locust Avenue Extension","TRUE PERFORMANCE IND","Y"
"Mount Pleasant","HABIBA HEALTH SERVICES PC",5,0.957,4,22,23,0,1,43241.5987,"828 West Main Street","TRUE PERFORMANCE AHN","Y"
"Mount Pleasant","EXCELA HEALTH MAIN STREET MEDICAL",1,1,5,125,125,0,0,43241.5987,"525 West Main Street","TRUE PERFORMANCE PLUS COMM","Y"
"Mount Pleasant","EFREN LEONIDA MD LLC",1,1,5,31,31,0,0,43241.5987,"One Braddock Avenue","TRUE PERFORMANCE IND","Y"
"Mount Pleasant","MILAD SHAKER",1,1,5,33,33,0,0,43241.5987,"308 Bessemer Road","TRUE PERFORMANCE IND","Y"
"Mount Pleasant","EXCELA HEALTH MOUNT PLEASANT FAMILY MED",6,0.909,3,10,11,1,1,43241.5987,"603 North Church Street","TRUE PERFORMANCE PLUS COMM","Y"
"Mount Pleasant","ESPOSITO MEDICAL ASSOCIATES LTD",1,1,5,16,16,0,0,43241.5987,"599 North Church Street","TRUE PERFORMANCE IND","Y"
"Mount Pocono","GMG MT POCONO FAMILY PRACTICE",1,1,5,11,11,0,0,48532.5843,"126 Market Way","TRUE PERFORMANCE CUSTOM CONTRACT","Y"
"Mountain Top","GMG MT TOP FAMILY PRACTICE",1,1,5,4,4,NA,NA,74884.6676,"35 S Mountain Blvd","TRUE PERFORMANCE CUSTOM CONTRACT","Y"
"Mountain Top","LUCAS, IRENE D MD",1,1,5,15,15,0,0,74884.6676,"62 North Mountain Boulevard","TRUE PERFORMANCE","Y"
"Mountville","PENN STATE MEDICAL GROUP MOUNTVILLE",1,1,5,35,35,0,0,64300.3725,"2 College Avenue","TRUE PERFORMANCE PLUS COMM","Y"
"Mt Holly Springs","WALNUT BOTTOM FAMILY PRACTICE LLC",1,0.963,4,26,27,0,1,59692.4888,"103 North Baltimore Avenue","TRUE PERFORMANCE","Y"
"Mt Lebanon","MEDI HELP",1,0.929,3,65,70,1,4,78749.4512,"1691 Washington Road","TRUE PERFORMANCE IND","Y"
"Mt Washington","DANAIE, NOSRATOLLAH MD",1,1,5,5,5,NA,NA,44085.6655,"20 Bailey Avenue","","Y"
"Mt Washington","FREY III, NORMAN J DO",2,0.732,2,30,41,9,11,44085.6655,"20 Bailey Avenue","TRUE PERFORMANCE IND","Y"
"Mullens","MULLENS FAMILY CLINIC",1,0.75,2,3,4,NA,NA,36011.1846,"300 Howard Avenue","","Y"
"Muncy","DILIP ELANGBAM MD LLC",1,0,1,0,5,NA,NA,45536.3701,"10 Shady Lane","","Y"
"Munhall","HANDELSMAN FAMILY PRACTICE LLC",1,1,5,77,77,0,0,38757.3924,"3212 Main Street","TRUE PERFORMANCE AHN","Y"
"Murrysville","MURRYSVILLE INTERNAL MEDICINE AND FAMILY ASSOCIATES",1,1,5,38,38,0,0,82456.2622,"4262 Old William Penn Highway","TRUE PERFORMANCE AHN","Y"
"Myerstown","NOONAN JR, FRANCIS C, DO",1,1,5,8,8,NA,NA,52151.3737,"420 West Lincoln Street","","Y"
"Myerstown","WELLSPAN FAMILY MEDICINE ELCO",1,1,5,27,27,0,0,52151.3737,"6 Perri Avenue","TRUE PERFORMANCE","Y"
"Myerstown","MYERSTOWN FAMILY PRAC PC",1,1,5,46,46,0,0,52151.3737,"431 West Lincoln Avenue","TRUE PERFORMANCE","Y"
"Nanticoke","WOLANIN, JANUSZ MD",2,0.944,4,17,18,0,1,37063.8356,"233 South Prospect Street","TRUE PERFORMANCE","Y"
"Nanticoke","GMG FAMILY PRACTICE NANTICOKE",3,0.889,3,8,9,NA,NA,37063.8356,"128 East Main St","TRUE PERFORMANCE CUSTOM CONTRACT","Y"
"Nanticoke","COMMONWEALTH PHYSICIAN NETWORK LLC",1,1,5,76,76,0,0,37063.8356,"4 East Main Street","TRUE PERFORMANCE","Y"
"Nanty Glo","CHI EBANDJIEFF PARKHILL",1,0.986,5,71,72,0,0,39475.7856,"1060 Lloyd Street","TRUE PERFORMANCE PLUS COMM","Y"
"Natrona Heights","RUSSELLTON MEDICAL GROUP UPMC",3,0.994,5,161,162,0,0,40427.0853,"1604 Burtner Road","","Y"
"Natrona Heights","KUMAR, RAKESH, MD",6,0.917,3,33,36,1,3,40427.0853,"1629 Union Avenue","","Y"
"Natrona Heights","VALLEY FAMILY MEDC UPMC",1,1,5,227,227,0,0,40427.0853,"1604 Burtner Road","","Y"
"Natrona Heights","NATRONA HEIGHTS MEDICAL ASSOCIATES UPMC",5,0.983,5,114,116,0,0,40427.0853,"1800 Union Avenue","","Y"
"Natrona Heights","ALLE KISKI MEDICAL ASSOCIATES",4,0.991,5,568,573,0,0,40427.0853,"1621 C Union Avenue","TRUE PERFORMANCE AHN","Y"
"Natrona Heights","ALLEGHENY VALLEY INTERNAL MEDICINE",1,1,5,249,249,0,0,40427.0853,"1719 Union Avenue","TRUE PERFORMANCE AHN","Y"
"Nazareth","DAVID P ZAMBO DO LLC",1,1,5,15,15,0,0,74782.2414,"4263 Lonat Drive","TRUE PERFORMANCE IND","Y"
"Nazareth","NAZARETH FAMILY PRACTICE",1,1,5,26,26,0,0,74782.2414,"305 West North Street","TRUE PERFORMANCE PLUS COMM","Y"
"Nazareth","SABRE PHYSICIANS PC",6,0.727,2,8,11,3,3,74782.2414,"111 South Spruce Street","TRUE PERFORMANCE","Y"
"Nazareth","WASSON, JAMES C, MD PC",1,1,5,27,27,0,0,74782.2414,"534 South Main Street","TRUE PERFORMANCE IND","Y"
"Nazareth","ST LUKES FAMILY MEDICINE NAZARETH",1,1,5,39,39,0,0,74782.2414,"4059 Jandy Boulevard","TRUE PERFORMANCE PLUS COMM","Y"
"Nazareth","LVPG FAMILY MEDICINE NAZARETH",1,1,5,12,12,0,0,74782.2414,"863 Nazareth Pike","TRUE PERFORMANCE IND","Y"
"Nesquehoning","JOHN BOSI DO, PC",2,0.909,3,10,11,1,1,39256.992,"426 West Railroad Street","TRUE PERFORMANCE","Y"
"Nesquehoning","ST LUKES PRIMARY CARE NESQUEHONING",1,1,5,11,11,0,0,39256.992,"1114 East Catawissa Street","TRUE PERFORMANCE PLUS COMM","Y"
"New Bethlehem","ARMSTRONG PRIMARY CARE CENTER SOUTH BETHLEHEM",1,1,5,70,70,0,0,44658.1707,"102 South Street","TRUE PERFORMANCE AHN","Y"
"New Brighton","FUNKHOUSER, JAY L MD",1,1,5,67,67,0,0,41859.5759,"721 Fifth Avenue","TRUE PERFORMANCE IND","Y"
"New Britain","CHALFONT FAMILY PRACTICE",1,0.25,1,1,4,NA,NA,86269.6339,"65 East Butler Avenue","","Y"
"New Castle","GABRIEL, STEVEN A MD PC",1,1,5,35,35,0,0,38244.3884,"29 East North Street","TRUE PERFORMANCE PLUS COMM","Y"
"New Castle","INTERNAL MEDC ASSOC LAWRENCE COUNTY",1,1,5,80,80,0,0,49205.078,"125 Enclave Drive","TRUE PERFORMANCE PLUS COMM","Y"
"New Castle","DOCTOR MALVAR AND ASSOCIATE",1,1,5,26,26,0,0,49205.078,"178 Enclave Drive","TRUE PERFORMANCE PLUS COMM","Y"
"New Castle","ST LUKES MEDICAL PC",1,1,5,25,25,0,0,49205.078,"3413 Wilmington Rd","TRUE PERFORMANCE PLUS COMM","Y"
"New Castle","REZK MEDICAL CLINIC LLC",1,1,5,15,15,0,0,38244.3884,"1750 New Butler Road","TRUE PERFORMANCE IND","Y"
"New Castle","ABUL ELA, MOHAMAD MD",1,1,5,4,4,NA,NA,49205.078,"212 Enclave Drive","TRUE PERFORMANCE PLUS COMM","Y"
"New Castle","TRI COUNTY MEDICAL ASSOCIATES OF PA PC",17,0.45,1,9,20,10,11,49205.078,"2602 Wilmington Road","TRUE PERFORMANCE PLUS COMM","Y"
"New Castle","FAMILY FIRST SWIFT CARE LLC",16,0.833,3,15,18,2,3,49205.078,"3128 Wilmington Road","","Y"
"New Castle","IRYNN AND ASSOCIATES",1,1,5,8,8,NA,NA,38244.3884,"3548 Ellwood Road","","Y"
"New Castle","UNION PRIMARY CARE UPMC",1,1,5,31,31,0,0,38244.3884,"2008 West State Street","","Y"
"New Castle","BHS JOANN LAMB MD AND ASSOCIATES",1,1,5,46,46,0,0,49205.078,"188 Enclave Drive","TRUE PERFORMANCE PLUS COMM","Y"
"New Castle","SHENANGO PRIMARY CARE UPMC",14,0.941,4,16,17,0,1,38244.3884,"1750 New Butler Road","","Y"
"New Castle","NOBLE HOUSE MEDICAL CLINIC UPMC",1,1,5,30,30,0,0,49205.078,"3124 Wilmington Road","","Y"
"New Castle","PRIMARY CARE OF WESTERN  PA UPMC",1,1,5,24,24,0,0,49205.078,"149 Enclave Drive","","Y"
"New Castle","NORBERTO YUMANG MD UPMC",1,1,5,9,9,NA,NA,49205.078,"2602 Wilmington Road","","Y"
"New Castle","MOHAMED TEJPAR MD UPMC",15,0.938,3,15,16,1,1,49205.078,"2602 Wilmington Road","","Y"
"New Castle","LAWRENCE COUNTY FAMILY MEDICINE",1,1,5,128,128,0,0,49205.078,"2520 Wilmington Road","TRUE PERFORMANCE PLUS COMM","Y"
"New Cumberland","FAMILY PHYSICIAN ASSOCIATES INC",1,0.932,3,41,44,1,3,64083.5832,"1900 Bridge Street","TRUE PERFORMANCE","Y"
"New Cumberland","GREEN HILL FAMILY HEALTH CENTER",2,0.778,2,7,9,NA,NA,64083.5832,"503 Bridge Street","","Y"
"New Eagle","MICHAEL, JOSEPH T MD",1,0.969,4,31,32,0,1,35271.2061,"433 Main Street","TRUE PERFORMANCE PLUS COMM","Y"
"New Freedom","WELLSPAN FAMILY MEDICINE STONEBRIDGE",1,0.985,5,66,67,0,0,72824.7618,"13515 Wolfe Road","TRUE PERFORMANCE","Y"
"New Holland","LGHP PENN MEDICINE FAMILY MEDICINE NEW HOLLAND",1,1,5,43,43,0,0,52933.4658,"676 East Main Street","LGH ACO","Y"
"New Holland","WELSH MOUNTAIN HEALTH CENTERS",1,1,5,3,3,NA,NA,52933.4658,"584 Springville Road","TRUE PERFORMANCE","Y"
"New Kensington","RICHLESS, LLOYD K, MD",1,1,5,7,7,NA,NA,45022.7992,"251 7th Street","","Y"
"New Kensington","COMMUNITY HEALTH CLINIC INC",4,0.786,2,11,14,3,3,45022.7992,"943 Fourth Avenue","","Y"
"New Kensington","JAMAL M ALJARI MD",5,0.705,1,31,44,11,13,45022.7992,"2300 Freeport Road","","Y"
"New Kensington","CITIZENS FAMILY HEALTH CLINIC INC",6,0.455,1,5,11,6,6,45022.7992,"251 Seventh Street","","Y"
"New Kensington","UNITED PHYSICIANS",3,0.993,5,296,298,0,0,45022.7992,"305 Seventh Street","TRUE PERFORMANCE AHN","Y"
"New Kensington","PAUL A REILLY MD AND ASSOCIATES",1,1,5,88,88,0,0,45022.7992,"315 7th Street","TRUE PERFORMANCE AHN","Y"
"New Martinsville","WETZEL COUNTY HOSPITAL PHYSICIANS",1,1,5,3,3,NA,NA,37715.4928,"3 East Benjamin Dr","TRUE PERFORMANCE","Y"
"New Martinsville","WETZEL COUNTY HOSPITAL PHYSICIANS",3,0.974,4,38,39,0,1,37715.4928,"3 East Benjamin Drive","TRUE PERFORMANCE","Y"
"New Martinsville","EDWARD L EMCH MD",1,1,5,12,12,0,0,37715.4928,"261 Monroe Avenue","","Y"
"New Martinsville","VALEO MEDICAL PLLC",4,0.75,2,3,4,NA,NA,37715.4928,"260 Russell Avenue","","Y"
"New Paris","HENRY W SHOENTHAL MD INC",1,1,5,92,92,0,0,43184.4213,"4186 Cortland Drive","TRUE PERFORMANCE IND","Y"
"New Philadelphia","MICHAEL J ZAWISZA DO PC",1,1,5,31,31,0,0,35553,"31 Valley Street","TRUE PERFORMANCE","Y"
"New Ringgold","ROSALEE REHRIG DO",1,1,5,7,7,NA,NA,53247.1862,"1976 West Penn Pike","TRUE PERFORMANCE","Y"
"New Stanton","NEW STANTON PRIMARY CARE",1,1,5,53,53,0,0,46270.0116,"512 South Center Avenue","TRUE PERFORMANCE IND","Y"
"New Tripoli","NORTHWESTERN MEDICAL CENTER PC",1,1,5,28,28,0,0,76739.1726,"7096 Decatur Street","TRUE PERFORMANCE IND","Y"
"New Wilmington","NEW WILMINGTON FAM MEDC ASSOC PC",1,0.979,4,46,47,0,1,49092.4661,"3438 State Route 208","TRUE PERFORMANCE PLUS COMM","Y"
"New Wilmington","BHS FAMILY MEDICAL CARE",1,0.979,4,93,95,0,1,49092.4661,"150 North New Castle Street","TRUE PERFORMANCE PLUS COMM","Y"
"Newark","CCHS SATELLITE OFFICES",1,0.429,1,3,7,NA,NA,54835.9279,"200 Hygeia Drive","TRUE PERFORMANCE CUSTOM CONTRACT","Y"
"Newport","TANNER, DAVID E DO",3,0.286,1,6,21,14,15,46475.1032,"82 Red Hill Road","","Y"
"Newport","PINNACLEHEALTH FAMILYCARE NEWPORT",1,1,5,66,66,0,0,46475.1032,"300 Bretz Court","TRUE PERFORMANCE PLUS COMM","Y"
"Newport","NEWPORT FAMILY PRACTICE PC",1,1,5,73,73,0,0,46475.1032,"52 Red Hill Court","TRUE PERFORMANCE","Y"
"Newton","PREMIER HEALTH ASSOCIATES LLC",1,0.5,1,2,4,NA,NA,74355.9384,"123 Newton Sparta Road","","Y"
"Newville","GRAHAM MEDICAL CENTER",1,1,5,87,87,0,0,54078.2211,"100 South High Street","TRUE PERFORMANCE","Y"
"Nitro","G MARK MORELAND MD",1,0.833,3,5,6,NA,NA,43111.4866,"2206 22nd Street","","Y"
"North Apollo","VELEZ, FIDEL E MD",1,0.629,1,22,35,11,13,37169,"1903 Acheson Avenue","","Y"
"North East","VINEYARD PRIMARY CARE",1,1,5,28,28,0,0,47693.2417,"2060 North Pearl Street","","Y"
"North East","NORTH EAST FAMILY PRACTICE",1,1,5,53,53,0,0,47693.2417,"115 East Main Street","TRUE PERFORMANCE AHN","Y"
"North Huntingdon","SANDERS, ROBERT E MD",1,1,5,57,57,0,0,63181.3156,"8981 Norwin Avenue","TRUE PERFORMANCE IND","Y"
"North Huntingdon","DANIEL MEDIC AND ASSOCIATES PC",1,1,5,106,106,0,0,63181.3156,"8791 Barnes Lake Rd","TRUE PERFORMANCE IND","Y"
