"City","Practice_Name","City.Rank","Compliance","Star_Rating","Numerator","Denominator","Needed4","Needed5","Med_Household","Address","Program","Stars_Par"
"North Huntingdon","EXCELA HEALTH PRIMARY CARE",4,0.997,5,340,341,0,0,63181.3156,"8775 Norwin Avenue","TRUE PERFORMANCE PLUS COMM","Y"
"North Huntingdon","WHITE OAK PRIMARY CARE - UPMC",5,0.963,4,26,27,0,1,63181.3156,"13370 Lincoln Way","","Y"
"North Huntingdon","NORWIN FAMILY MEDICINE UPMC",1,1,5,31,31,0,0,63181.3156,"12279 Route 30","","Y"
"Northampton","NORTHAMPTON MEDICAL ASSOCIATES",1,1,5,26,26,0,0,59483.2247,"602 B East 21st Street","TRUE PERFORMANCE","Y"
"Northampton","ST LUKES NORTHERN VALLEY PRIMARY CARE",1,1,5,51,51,0,0,59483.2247,"44 West 21st Street","TRUE PERFORMANCE PLUS COMM","Y"
"Northern Cambria","CAMBRIA FAMILY PRACTICE LLC",1,1,5,8,8,NA,NA,42449.0838,"1704 Philadelphia Avenue","","Y"
"Northern Cambria","NORTHERN CAMBRIA MED CTR WILLIAM PARONISH MD INC",1,1,5,35,35,0,0,42449.0838,"1106 Bigler Avenue","TRUE PERFORMANCE IND","Y"
"Norvelt","LAH NORVELT FAMILY HEALTH",1,0.992,5,131,132,0,0,62157,"3888 Route 981","TRUE PERFORMANCE PLUS COMM","Y"
"Noxen","RURAL HEALTH CORP MED DIV",1,0.968,4,30,31,0,1,47884.1078,"2888 State Route 29 South","TRUE PERFORMANCE","Y"
"Oak Hill","OAK HILL CLINIC CORPORATION",1,0.75,2,6,8,NA,NA,28703.6245,"320 Jones Avenue","","Y"
"Oakmont","SMA JEROME SCHERER DO",1,1,5,51,51,0,0,56326.6595,"135 Allegheny Avenue","","Y"
"Oakmont","GOLANI MEDICAL ASSOCIATES UPMC",1,1,5,22,22,0,0,56326.6595,"135 Allegheny Avenue","","Y"
"Oakmont","DANIEL STEINER MD UPMC",4,0.976,4,40,41,0,1,56326.6595,"135 Allegheny Avenue","","Y"
"Oakmont","THE PRIMARY CARE PLACE",1,1,5,47,47,0,0,56326.6595,"333 Allegheny Avenue","TRUE PERFORMANCE AHN","Y"
"Oil City","VENANGO INTERNAL MEDC ASSOC UPMC",1,0.955,4,21,22,0,1,35018.4902,"1 Memorial Drive","","Y"
"Old Forge","DUNAY, DARLENE A DO",2,0.944,4,17,18,0,1,49875.0504,"314 Oak Street","TRUE PERFORMANCE","Y"
"Old Forge","MICHAEL A JALOWIEC DO PC",1,1,5,6,6,NA,NA,49875.0504,"821 South Main Street","TRUE PERFORMANCE","Y"
"Olyphant","PRIME MED GEISINGER OLYPHANT",1,1,5,11,11,0,0,47477.7019,"221 River St","TRUE PERFORMANCE","Y"
"Orbisonia","SOUTHERN HUNTINGDON COUNTY MED CENTER",1,1,5,21,21,0,0,39748.842,"626 Water Street","TRUE PERFORMANCE IND","Y"
"Orefield","NORTH WHITEHALL FAMILY PRACTICE",2,0.9,3,18,20,1,2,83870.1677,"3560 Route 309","TRUE PERFORMANCE PLUS COMM","Y"
"Orefield","LVPG FAMILY MEDICINE OREFIELD",1,1,5,48,48,0,0,83870.1677,"5074 Kernsville Road","TRUE PERFORMANCE IND","Y"
"Orwigsburg","GMG ORWIGSBURG FAMILY PRACTICE",1,1,5,23,23,0,0,53262.273,"300 Hollywood Boulevard","TRUE PERFORMANCE CUSTOM CONTRACT","Y"
"Palmer Township","ST LUKES FAMILY PRACTICE PALMER",1,1,5,18,18,0,0,69973.5931,"3213 Nazareth Road","TRUE PERFORMANCE PLUS COMM","Y"
"Palmerton","CARBON MEDICAL ASSOCIATES INC",1,0.966,4,28,29,0,1,50699.8331,"218A Delaware Avenue","TRUE PERFORMANCE","Y"
"Palmerton","ZHOU, JOE S MD",2,0.778,2,7,9,NA,NA,50699.8331,"135 Lafayette Ave 2nd Fl","","Y"
"Palmerton","JOHN H NICHOLSON DO PC",3,0.5,1,6,12,6,6,50699.8331,"169 Delaware Avenue","TRUE PERFORMANCE","Y"
"Palmyra","LEBANON VALLEY FAMILY MEDICINE",1,0.988,5,400,405,0,0,60668.6685,"1400 South Forge Road","TRUE PERFORMANCE","Y"
"Palmyra","PENN STATE HERSHEY MEDICAL GROUP PALMYRA",2,0.985,5,132,134,0,0,60668.6685,"941 Park Drive","TRUE PERFORMANCE PLUS COMM","Y"
"Paoli","MAIN LINE HEALTHCARE INTERNAL MEDICINE",1,0.2,1,1,5,NA,NA,99899.4403,"2 Industrial Boulevard","","Y"
"Parkersburg","PARKERSBURG FAMILY MEDICAL ASSOCIATES",6,0.889,3,8,9,NA,NA,45798.6351,"2900 Emerson Avenue","","Y"
"Parkersburg","MHC PHYSICIANS INC",7,0.75,2,6,8,NA,NA,43798.1948,"418 Grand Park Drive","","Y"
"Parkersburg","RIVER VALLEY MEDICINE AND PEDIATRICS INC",1,1,5,3,3,NA,NA,34544.857,"2012 Garfield Avenue","TRUE PERFORMANCE","Y"
"Parkersburg","MICHAEL S MOSES MD",1,1,5,7,7,NA,NA,45798.6351,"1512 36th Street","","Y"
"Parkersburg","TERRY W CAPEL MD",7,0.75,2,3,4,NA,NA,34544.857,"1019 Garfield Avenue","","Y"
"Parkersburg","JENNIFER L LEAVITT DO",1,1,5,7,7,NA,NA,34544.857,"936 Market Street","","Y"
"Parkersburg","MID OHIO VALLEY MEDICINE & PEDIATRICS PLLC",1,1,5,3,3,NA,NA,34544.857,"2012 Garfield Avenue","TRUE PERFORMANCE","Y"
"Parkersburg","CAMDEN CLARK PHYSICIAN CORPORATION",5,0.969,4,31,32,0,1,34544.857,"705 Garfield Ave","TRUE PERFORMANCE","Y"
"Patton","PATTON MEDICAL HEALING CENTER LLC",1,1,5,18,18,0,0,38422.2174,"503 Railroad Avenue","TRUE PERFORMANCE IND","Y"
"Patton","RUSSELL MILLER MD FAM PRAC",1,1,5,44,44,0,0,38422.2174,"121 Beech Avenue","TRUE PERFORMANCE PLUS COMM","Y"
"Peckville","LEE T BESEN MD",2,0,1,0,4,NA,NA,38153,"1339 Main Street","TRUE PERFORMANCE","Y"
"Peckville","PRIMEMED GEISINGER PECKVILLE",1,1,5,31,31,0,0,38153,"320 Keystone Avenue","TRUE PERFORMANCE","Y"
"Pen Argyl","DOUGLAS F TURTZO MD FACP",1,1,5,7,7,NA,NA,57269.9246,"101 South Schanck Avenue","TRUE PERFORMANCE IND","Y"
"Pen Argyl","LVPG FAMILY MEDICINE BANGOR",1,1,5,21,21,0,0,57269.9246,"1337 Blue Valley Drive","TRUE PERFORMANCE IND","Y"
"Pennsburg","PENNSBURG FAMILY PRACTICE",1,1,5,3,3,NA,NA,69639.4628,"2793 Geryville Pike","","Y"
"Pennsdale","MUNCY FAMILY PRACTICE LLC",1,1,5,8,8,NA,NA,45536.3701,"151 John Brady Drive","TRUE PERFORMANCE","Y"
"Perkasie","TRIVALLEY PRIMARY CARE PC",1,0.333,1,1,3,NA,NA,79616.6131,"519 South Fifth Street","","Y"
"Perryopolis","PERRYO MEDICAL CENTER",1,1,5,86,86,0,0,35359.8395,"405 Liberty Street","TRUE PERFORMANCE PLUS COMM","Y"
"Perryopolis","NAVARRO HEALTH CARE PC",2,0.833,3,10,12,2,2,35359.8395,"3379 Pittsburgh Road","","Y"
"Petersburg","BENSENHAVER MEDICAL PRACTICE",1,0.143,1,1,7,NA,NA,34096.9044,"100 Hospital Drive","TRUE PERFORMANCE","Y"
"Phila","GREENHOUSE INTERNISTS PC",1,0.667,1,2,3,NA,NA,55275.0067,"345 East Mount Airy Avenue","","Y"
"Philadelphia","JEFFERSON FAMILY MEDICINE ASSOCIATES",3,0.333,1,1,3,NA,NA,41799.8095,"833 Chestnut Street","","Y"
"Philadelphia","JEFFERSON INTERNAL MEDICINE ASSOCIATES",5,0,1,0,3,NA,NA,41799.8095,"833 Chestnut Street East","","Y"
"Philadelphia","PENN RODEBAUGH DIABETES CENTER",1,0.6,1,3,5,NA,NA,22376.3593,"51 North 39th Street","","Y"
"Philadelphia","INTEGRATED WOUND SPECIALISTS OF PA PLLC",2,0.4,1,2,5,NA,NA,46237.8123,"7600 Central Avenue","","Y"
"Philadelphia","PENNCARE INTERNAL MEDICINE ASSOCIATES AT THE SCIENCE CENTER",4,0.25,1,1,4,NA,NA,22376.3593,"3701 Market Street","","Y"
"Philipsburg","GUIDED CARE PC",3,0.8,2,4,5,NA,NA,38848.1869,"330 Enterprise Drive","","Y"
"Philipsburg","GMG PHILIPSBURG INTERNAL MEDICINE",1,1,5,36,36,0,0,38848.1869,"210 Medical Center Drive","TRUE PERFORMANCE CUSTOM CONTRACT","Y"
"Philipsburg","MOSHANNON VALLEY RURAL HEALTH CENTER",2,0.92,3,23,25,1,2,38848.1869,"271 Railroad Street","TRUE PERFORMANCE","Y"
"Phoenixville","PMA MEDICAL SPECIALISTS LLC",1,0.667,1,6,9,NA,NA,86419.5874,"826 Main Street","","Y"
"Pine Grove","INTEGRATED MEDICAL GROUP PC",1,1,5,131,131,0,0,50994.923,"8 Oak Grove Road","TRUE PERFORMANCE","Y"
"Pine Grove","SCALIA PRIMARY CARE PC",1,1,5,15,15,0,0,50994.923,"35 Tremont Road","TRUE PERFORMANCE","Y"
"Pittsburgh","NELSON, LAWRENCE J MD",150,0.692,1,9,13,4,4,55607.3086,"777 Clairton Boulevard","","Y"
"Pittsburgh","HOOVER MEDICAL ASSOCIATES PC",1,1,5,34,34,0,0,22397.3403,"1400 Locust Street","","Y"
"Pittsburgh","UPP  GASTROENTEROLOGY",1,1,5,10,10,0,0,32228.0668,"200 Lothrop Street","","Y"
"Pittsburgh","UPMC SENIOR CARE AT SHADY SIDE",92,0.992,5,117,118,0,0,32228.0668,"200 Lothrop Street","","Y"
"Pittsburgh","UPP HEART AND VASCULAR INSTITUTE",111,0.981,5,52,53,0,0,32228.0668,"3600 Forbes Avenue","","Y"
"Pittsburgh","MORETTI, JAMES M MD",1,1,5,45,45,0,0,106045.9841,"2589 Washington Road","","Y"
"Pittsburgh","SEETHA CHANDRA MD UPMC",1,1,5,8,8,NA,NA,37425.1418,"2020 Ardmore Boulevard","","Y"
"Pittsburgh","FAMILY PROFESSIONAL CENTER PC",132,0.905,3,19,21,1,2,55607.3086,"60 Terence Drive","","Y"
"Pittsburgh","UPMC SOUTH HILLS ENDOCRINOLOGY",1,1,5,18,18,0,0,32228.0668,"3601 Fifth Avenue","","Y"
"Pittsburgh","UNIV INFECTIOUS DISEASE SVC",1,1,5,4,4,NA,NA,32228.0668,"3600 Forbes Avenue","","Y"
"Pittsburgh","GMA KOMAN AND KIMMELL FAMILY PRACTICE",1,1,5,83,83,0,0,70890.1741,"8150 Perry Highway","TRUE PERFORMANCE PLUS COMM","Y"
"Pittsburgh","EAST LIBERTY FAMILY HEALTH CARE CENTER",1,1,5,46,46,0,0,39660.7774,"6023 Harvard Street","TRUE PERFORMANCE IND","Y"
"Pittsburgh","UNIVERSITY ORTHOPAEDICS INC",138,0.8,2,4,5,NA,NA,32228.0668,"3471 Fifth Avenue","","Y"
"Pittsburgh","LOBUR, PAUL T., MD",1,1,5,20,20,0,0,78579.877,"1050 Bower Hill Road","","Y"
"Pittsburgh","HO, YEE C MD",1,1,5,23,23,0,0,37425.1418,"810 Wood Street","","Y"
"Pittsburgh","VERNINO, RICHARD J, DO",152,0.643,1,9,14,5,5,44085.6655,"5 Grandview Avenue","","Y"
"Pittsburgh","UNIV RHEUMATOLOGY SVC",1,1,5,26,26,0,0,32228.0668,"3601 5th Avenue","","Y"
"Pittsburgh","FLETCHER, DOUGLAS D MD",145,0.727,2,16,22,5,6,37425.1418,"221 Penn Avenue","","Y"
"Pittsburgh","SCOTT MEDICAL HEALTH CENTER PC",1,1,5,5,5,NA,NA,51163.5572,"2275 Swallow Hill Road","","Y"
"Pittsburgh","AHMED, ADIBA S MD",154,0.333,1,1,3,NA,NA,51163.5572,"2101 Greentree Road","TRUE PERFORMANCE AHN","Y"
"Pittsburgh","ASSOCIATES IN DIAGNOSTIC INTERNAL MEDICINE",128,0.929,3,39,42,1,3,32228.0668,"300 Halket Street","","Y"
"Pittsburgh","HARETOS, JOHN T., MD",130,0.92,3,23,25,1,2,32228.0668,"160 North Craig Street","","Y"
"Pittsburgh","CHOLAPRANEE, REWAT MD",137,0.824,2,14,17,2,3,70890.1741,"135 Cumberland Road","","Y"
"Pittsburgh","LEVI WALKER MD PC",1,1,5,17,17,0,0,22397.3403,"1811 Boulevard of the Allies","TRUE PERFORMANCE AHN","Y"
"Pittsburgh","ONCOLOGY HEMATOLOGY ASSOCIATION",119,0.966,4,28,29,0,1,45928.1315,"5115 Centre Avenue","","Y"
"Pittsburgh","FLAHERTY, MORGAN F MD",142,0.774,2,24,31,6,7,101351.9137,"1370 Old Freeport Road","","Y"
"Pittsburgh","BURKE AND BRADLEY ORTHOPEDICS",1,1,5,3,3,NA,NA,73584.7475,"200 Delafield Road","","Y"
"Pittsburgh","PRIMARY CARE HEALTH SERVICES GROUP PRACTICE",1,1,5,40,40,0,0,22397.3403,"1835 Centre Avenue","","Y"
"Pittsburgh","BAHL AND BAHL MED ASSOC",107,0.984,5,124,126,0,0,48687.4696,"10922 Frankstown Road","TRUE PERFORMANCE IND","Y"
"Pittsburgh","PURPURA, LAWRENCE J MD",149,0.708,1,17,24,6,7,47118.8084,"1206 Brookline Boulevard","","Y"
"Pittsburgh","DRS JOHN CHANTZ AND ASSOCIATES UPMC",1,1,5,135,135,0,0,73584.7475,"100 Delafield Road","","Y"
"Pittsburgh","CAMPBELL AND PHILBIN MEDICAL ASSOC",1,1,5,174,174,0,0,22397.3403,"1400 Locust Street","TRUE PERFORMANCE IND","Y"
"Pittsburgh","RUBIN, FRED H MD",1,1,5,8,8,NA,NA,45928.1315,"5200 Centre Avenue","","Y"
"Pittsburgh","UNIV ONCOLOGY SERVICE",1,1,5,5,5,NA,NA,32228.0668,"3600 Forbes Avenue","","Y"
"Pittsburgh","USA VEIN CLINICS OF PITTSBURGH LLC",151,0.667,1,2,3,NA,NA,101351.9137,"300 Chapel Harbor Drive","","Y"
"Pittsburgh","MCGINNIS THORACIC AND CARDIOVASCULAR ASSOCIATES",1,1,5,22,22,0,0,35830.6454,"320 East North Avenue","","Y"
"Pittsburgh","RABINOWITZ AND CIESIELKA MDS",118,0.967,4,59,61,0,1,30284.2042,"5173 Liberty Avenue","TRUE PERFORMANCE IND","Y"
"Pittsburgh","OFFERMAN, JOOP, MD",111,0.981,5,52,53,0,0,39660.7774,"6740 Reynolds Street","TRUE PERFORMANCE IND","Y"
"Pittsburgh","UNIVERSITY GENERAL INTERNAL MEDICINE",1,1,5,21,21,0,0,45928.1315,"5230 Centre Avenue","","Y"
"Pittsburgh","NORTH SIDE CHRISTIAN HEALTH CENTER",127,0.933,3,14,15,1,1,35830.6454,"816 Middle Street","","Y"
"Pittsburgh","UNIVERSITY GERIATRIC MEDICINE SERVICE",126,0.938,3,15,16,1,1,32228.0668,"200 Lothrop Street","","Y"
"Pittsburgh","PITTSBURGH GENERAL MEDICINE ASSOCIATES",89,0.993,5,288,290,0,0,35830.6454,"1307 Federal Street","TRUE PERFORMANCE AHN","Y"
"Pittsburgh","AGH INTERNAL MEDICINE",1,1,5,191,191,0,0,35830.6454,"1307 Federal Street","TRUE PERFORMANCE AHN","Y"
"Pittsburgh","ALLEGHENY ORTHOPAEDIC ASSOCIATES",1,1,5,22,22,0,0,35830.6454,"1307 Federal Street","","Y"
"Pittsburgh","PENN PLUM FAMILY MEDICINE UPMC",115,0.978,4,88,90,0,1,48687.4696,"7175 Saltsburg Road","","Y"
"Pittsburgh","DOUGLAS F CLOUGH MD AND ASSOC PC",1,1,5,76,76,0,0,70890.1741,"9104 Babcock Boulevard","TRUE PERFORMANCE IND","Y"
"Pittsburgh","GENERAL MEDICAL PRACTITIONERS PC",143,0.765,2,13,17,3,4,35830.6454,"1312 Federal Street","","Y"
"Pittsburgh","PRABHU PRIMARY CARE PC",1,1,5,39,39,0,0,78579.877,"1050 Bower Hill Road","","Y"
"Pittsburgh","GROB SCHERI WOODBURN AND GRIFIN FAMILY MEDICINE",1,1,5,238,238,0,0,70890.1741,"1140 Perry Highway","TRUE PERFORMANCE PLUS COMM","Y"
"Pittsburgh","DAYALAN & ASSOCIATES FAMILY MEDICINE",1,1,5,105,105,0,0,70890.1741,"3601 McKnight East Drive","TRUE PERFORMANCE PLUS COMM","Y"
"Pittsburgh","GMA HEYL FAMILY PRACTICE",92,0.992,5,127,128,0,0,55733.5687,"1020 Center Avenue","TRUE PERFORMANCE PLUS COMM","Y"
"Pittsburgh","PITTSBURGH FAMILY PRACTICE ASSOC LLC",120,0.96,4,24,25,0,1,22397.3403,"1517 Forbes Avenue","TRUE PERFORMANCE IND","Y"
"Pittsburgh","METRO FAMILY PRACTICE INC",107,0.984,5,62,63,0,0,48658.4649,"1789 South Braddock Avenue","TRUE PERFORMANCE IND","Y"
"Pittsburgh","ALLEGHENY MEDICAL PC",129,0.923,3,12,13,1,1,90388,"2000 Cliff Mine Road","TRUE PERFORMANCE IND","Y"
"Pittsburgh","UPMC PACT CLINIC",1,1,5,3,3,NA,NA,32228.0668,"3601 Fifth Avenue","","Y"
"Pittsburgh","UPMC SQUIRREL HILL",124,0.941,4,16,17,0,1,59637.4129,"5608 Wilkins Avenue","","Y"
"Pittsburgh","GMA NORTHERN AREA FAMILY MED",92,0.992,5,123,124,0,0,70890.1741,"5700 Corporate Drive","TRUE PERFORMANCE PLUS COMM","Y"
"Pittsburgh","UPP SPECIALTY PRACTICE SERVICES",1,1,5,19,19,0,0,45928.1315,"5200 Centre Avenue","","Y"
"Pittsburgh","GMA WILLIAM ZILLWEGER MED PRAC",1,1,5,25,25,0,0,70890.1741,"9104 Babcock Blvd","TRUE PERFORMANCE PLUS COMM","Y"
"Pittsburgh","UPMC SHADYSIDE FAMILY HEALTH CENTERS INC",1,1,5,17,17,0,0,45928.1315,"5215 Centre Avenue","","Y"
"Pittsburgh","COMMUNITY CARE PLUS",141,0.788,2,26,33,6,7,45961.4011,"601 Monroe Avenue","","Y"
"Pittsburgh","EMMANUEL FAMILY PRACTICE ASSOCIATES",1,1,5,41,41,0,0,48658.4649,"1789 South  Braddock Avenue","TRUE PERFORMANCE AHN","Y"
"Pittsburgh","GREATER PITTSBURGH MED ASSOC UPMC",97,0.99,5,198,200,0,0,42694.2705,"900 Mount Royal Boulevard","","Y"
"Pittsburgh","SMITHFIELD MEDICAL",1,1,5,47,47,0,0,42763.5971,"309 Smithfield Street","TRUE PERFORMANCE IND","Y"
"Pittsburgh","IYER, VISH, MD",138,0.8,2,4,5,NA,NA,42694.2705,"30 High Street","","Y"
"Pittsburgh","GOWDA, ANU MD",125,0.939,3,31,33,1,2,48687.4696,"11618 Frankstown Rd","TRUE PERFORMANCE IND","Y"
"Pittsburgh","OFFICE BASED ANESTHESIA SOLUTIONS INC",131,0.917,3,11,12,1,1,70890.1741,"9400 McKnight Road","","Y"
"Pittsburgh","KHAN MEDICAL ASSOC LLC",1,1,5,71,71,0,0,37425.1418,"200 Penn Avenue","TRUE PERFORMANCE IND","Y"
"Pittsburgh","PPCP AUSTIN PURIGHALLA",1,1,5,201,201,0,0,78579.877,"1050 Bower Hill Road","TRUE PERFORMANCE PLUS COMM","Y"
"Pittsburgh","PPCP JOHN G YAROS MD",1,1,5,34,34,0,0,78579.877,"363 Vanadium Road","TRUE PERFORMANCE PLUS COMM","Y"
"Pittsburgh","PPCP FLEET STREET",1,1,5,144,144,0,0,51163.5572,"300 Fleet Street","TRUE PERFORMANCE PLUS COMM","Y"
"Pittsburgh","PPCP JEFFERSON BETHEL",89,0.993,5,149,150,0,0,55607.3086,"140 Curry Hollow Road","TRUE PERFORMANCE PLUS COMM","Y"
"Pittsburgh","FAMILY MEDICINE RUTOVIC PC",1,1,5,70,70,0,0,55607.3086,"5119 Clairton Boulevard","","Y"
"Pittsburgh","DALJIT SINGH MD ASSOCIATES",97,0.99,5,103,104,0,0,42694.2705,"900 Mt Royal Boulvard","TRUE PERFORMANCE AHN","Y"
"Pittsburgh","MONTOUR FAM HEALTHCARE",1,1,5,40,40,0,0,90388,"1000 Cliff Mine Road","TRUE PERFORMANCE IND","Y"
"Pittsburgh","ADAMS, ROCCO J MD",1,1,5,35,35,0,0,48093.906,"3000 Brownsville Rd","","Y"
"Pittsburgh","LADANI MEDICAL ASSOCIATES LLC",1,1,5,26,26,0,0,31996.8378,"2409 Brownsville Road","","Y"
"Pittsburgh","PATEL MEDICAL ASSOC",1,1,5,52,52,0,0,31996.8378,"2409 Brownsville Road","TRUE PERFORMANCE IND","Y"
"Pittsburgh","ALLEGHENY CLINIC MEDICAL ONCOLOGY",1,1,5,12,12,0,0,30284.2042,"4815 Liberty Avenue","","Y"
"Pittsburgh","PRIME CARE INT MEDC ASSOC PC",1,1,5,42,42,0,0,65031.4446,"1049 Unity Center Rd","TRUE PERFORMANCE AHN","Y"
"Pittsburgh","ADLER AND KRAUSE CARD MED ASSOC",153,0.636,1,7,11,4,4,37425.1418,"21 Yost Boulevard","","Y"
"Pittsburgh","PEFHA HEALTH AND WELLNESS CTR PC",1,1,5,22,22,0,0,48687.4696,"8989 Frankstown Road","","Y"
"Pittsburgh","MONAH JR, RONALD O MD",1,1,5,36,36,0,0,45961.4011,"660 Lincoln Avenue","","Y"
"Pittsburgh","MARGOLIS RHEUMATOLOGY UPMC",122,0.957,4,22,23,0,1,42763.5971,"339 Sixth Ave","","Y"
"Pittsburgh","ARTHRITIS & INTERNAL MEDICINE ASSOCIATES UPMC",1,1,5,4,4,NA,NA,45928.1315,"580 South Aiken Avenue","","Y"
"Pittsburgh","TENENOUSER BARRY MD",1,1,5,3,3,NA,NA,32228.0668,"146 North Bellefield Avenue","","Y"
"Pittsburgh","HVMG FAMILY PRACTICE ROBINSON",1,1,5,68,68,0,0,47440.9517,"2201 Park Manor Boulevard","TRUE PERFORMANCE PLUS COMM","Y"
"Pittsburgh","SNELL, EDWARD D MD PCP",1,1,5,10,10,0,0,35830.6454,"1307 Federal Street","","Y"
"Pittsburgh","SQUIRREL HILL HEALTH CENTER",147,0.72,2,18,25,6,7,59637.4129,"4516 Browns Hill Road","","Y"
"Pittsburgh","BRENTWOOD MEDICAL GROUP INC",83,0.996,5,234,235,0,0,48093.906,"3720 Brownsville Road","TRUE PERFORMANCE AHN","Y"
"Pittsburgh","FORT PITT SENIOR HEALTH CARE ASSOCIATES",134,0.889,3,8,9,NA,NA,22397.3403,"1350 Locust Street","TRUE PERFORMANCE IND","Y"
"Pittsburgh","GLEASON MEDICAL ASSOCIATES UPMC",1,1,5,67,67,0,0,48658.4649,"1789 South Braddock Avenue","","Y"
"Pittsburgh","CRAIG MEDICAL ASSOCIATES UPMC",1,1,5,73,73,0,0,59637.4129,"6301 Forbes Avenue","","Y"
"Pittsburgh","SUBURBAN EAST MEDICAL CENTER UPMC",97,0.99,5,100,101,0,0,48687.4696,"3436 William Penn Highway","","Y"
"Pittsburgh","SOLANO AND KOKALES INTERNAL MEDICINE ASSOC UPMC",103,0.988,5,80,81,0,0,32228.0668,"120 Lytton Avenue","","Y"
"Pittsburgh","MIECZYSLAW WEINFELD MD UPMC",1,1,5,6,6,NA,NA,59637.4129,"6301 Forbes Avenue","","Y"
"Pittsburgh","UPMC DOWNTOWN",109,0.982,5,107,109,0,0,42763.5971,"339 Sixth Avenue","","Y"
"Pittsburgh","INTERNAL MEDICINE UPMC",89,0.993,5,135,136,0,0,32228.0668,"120 Lytton Avenue","","Y"
"Pittsburgh","EDWARDS, ROBERT G MD PC",1,1,5,37,37,0,0,39660.7774,"1539 Lincoln Avenue","","Y"
"Pittsburgh","BERNACKI FAMILY PRACTICE AND WELLNESS CENTER",114,0.979,4,46,47,0,1,35639.1575,"521 Greenfield Avenue","TRUE PERFORMANCE IND","Y"
"Pittsburgh","CLEMENTS, HARRY MICHAEL, MD",1,1,5,9,9,NA,NA,47118.8084,"1049 Brookline Boulevard","","Y"
"Pittsburgh","S W LEEHAN MD PC",1,1,5,31,31,0,0,55607.3086,"455 East Bruceton Road","TRUE PERFORMANCE AHN","Y"
"Pittsburgh","PITTLE, HOWARD S MD PC",145,0.727,2,56,77,17,20,55607.3086,"5247 Brownsville Road","","Y"
"Pittsburgh","STEEL CITY INTERNAL MEDICINE UPMC",83,0.996,5,248,249,0,0,70890.1741,"5700 Corporate Drive","","Y"
"Pittsburgh","GMA HECK AND ASSOC MEDICAL PRACTICE",1,1,5,68,68,0,0,35830.6454,"1622 Lowrie Street","TRUE PERFORMANCE PLUS COMM","Y"
"Pittsburgh","PITTSBURGH INTERNAL MED ASSOC UPMC",92,0.992,5,246,248,0,0,47118.8084,"3089 Sussex Avenue","","Y"
"Pittsburgh","HILLTOP COMMUNITY HEALTHCARE CENTER PCP",138,0.8,2,4,5,NA,NA,44085.6655,"151 Ruth Street","","Y"
"Pittsburgh","SHABBIR LAKDAWALA MD PC",134,0.889,3,16,18,1,2,48409.2639,"2912 Glenmore Avenue","","Y"
"Pittsburgh","STULL JARVIS AND SPINOLA INTERNAL MEDICINE ASSOCIATES UPMC",105,0.986,5,73,74,0,0,45928.1315,"5215 Centre Avenue","","Y"
"Pittsburgh","RFP MILLVALE UPMC",116,0.974,4,74,76,0,1,54615.556,"111 Sheridan Street","","Y"
"Pittsburgh","RFP ASPINWALL UPMC",101,0.989,5,88,89,0,0,73584.7475,"200 Delafield Road","","Y"
"Pittsburgh","RENAISSANCE FAMILY PRACTICE UPMC",101,0.989,5,181,183,0,0,42694.2705,"619 Mount Royal Boulevard","","Y"
"Pittsburgh","HEALTH CENTER ASSOCIATES UPMC",103,0.988,5,170,172,0,0,101351.9137,"2585 Freeport Road","","Y"
"Pittsburgh","FATIGATI AND NALIN ASSOCIATES",96,0.991,5,552,557,0,0,78749.4512,"733 Washington Road","TRUE PERFORMANCE PLUS COMM","Y"
"Pittsburgh","ALLEGHENY PULMONARY AND CRITICAL CARE",1,1,5,14,14,0,0,35830.6454,"320 East North Avenue","","Y"
"Pittsburgh","PRIMARY CARE GROUP 3 ,  JOSEPH SANTIESTEBAN , MD",1,1,5,50,50,0,0,35639.1575,"5426 Mifflin Road","TRUE PERFORMANCE AHN","Y"
"Pittsburgh","LINDER, PAUL G MD",123,0.944,4,67,71,0,3,55607.3086,"1201 Broughton Road","TRUE PERFORMANCE AHN","Y"
"Pittsburgh","WEST PENN MEDICAL ASSOCIATES",83,0.996,5,478,480,0,0,30284.2042,"4727 Friendship Avenue","TRUE PERFORMANCE AHN","Y"
"Pittsburgh","V E REYES MD AND ASSOCIATES",109,0.982,5,55,56,0,0,55607.3086,"67 Old Clairton Road","TRUE PERFORMANCE AHN","Y"
"Pittsburgh","PRIMARY CARE GROUP 7 JRMC INTERNAL MEDICINE",1,1,5,59,59,0,0,55607.3086,"810 Clairton Boulevard","TRUE PERFORMANCE AHN","Y"
"Pittsburgh","PCG 10 MCCORMICK MEDICAL ASSOCIATES",1,1,5,52,52,0,0,48093.906,"3720 Brownsville Road","TRUE PERFORMANCE AHN","Y"
"Pittsburgh","SQUIRREL HILL FAMILY PRACTICE UPMC",1,1,5,12,12,0,0,59637.4129,"6301 Forbes Avenue","","Y"
"Pittsburgh","PLENARY FAMILY PRACTICE UPMC",1,1,5,18,18,0,0,59637.4129,"6301 Forbes Avenue","","Y"
"Pittsburgh","DOBKIN AND RICCELLI ASSOCIATES",97,0.99,5,98,99,0,0,56446.6651,"250 Mount Lebanon Boulevard","TRUE PERFORMANCE PLUS COMM","Y"
"Pittsburgh","COMPREHENSIVE CARE ASSOCIATES UPMC",121,0.958,4,113,118,0,3,30284.2042,"5140 Liberty Avenue","","Y"
"Pittsburgh","GREENTREE MEDICAL CENTER PC",1,1,5,40,40,0,0,51163.5572,"995 Greentree Road","TRUE PERFORMANCE IND","Y"
"Pittsburgh","DEGIOVANNI MONTINI ASSOCIATES",133,0.902,3,101,112,5,9,78749.4512,"717 Washington Road","TRUE PERFORMANCE PLUS COMM","Y"
"Pittsburgh","PITTSBURGH MERCY FAMILY HEALTH CTR",148,0.714,1,10,14,4,4,39540.609,"249 South 9th Street","","Y"
"Pittsburgh","SHADYSIDE CARDIOLOGY ASSOCIATES",1,1,5,38,38,0,0,30284.2042,"5140 Liberty Avenue","","Y"
"Pittsburgh","RUBINSTEIN, RENEE F MD",1,1,5,6,6,NA,NA,47440.9517,"5168 Campbells Run Road","","Y"
"Pittsburgh","PPCP NOBLECARE",105,0.986,5,72,73,0,0,78579.877,"1145 Bower Hill Road","TRUE PERFORMANCE PLUS COMM","Y"
"Pittsburgh","COMMUNITY FAMILY PRACTICE UPMC",1,1,5,63,63,0,0,37425.1418,"1713 Ardmore Boulevard","","Y"
"Pittsburgh","ALLEGHENY HEALTH GERIATRIC SERVICES",136,0.833,3,5,6,NA,NA,30284.2042,"4727 Friendship Avenue","","Y"
"Pittsburgh","ST MARGARET FAMILY HEALTH CENTER",1,1,5,20,20,0,0,35900.0047,"3937 Butler Street","","Y"
"Pittsburgh","ST MARGARET GERIATRIC CARE CENTER",1,1,5,20,20,0,0,73584.7475,"100 Delafield Road","","Y"
"Pittsburgh","COMMUNITY PRIMARY CARE",1,1,5,156,156,0,0,55733.5687,"1000 West View Park Drive","TRUE PERFORMANCE AHN","Y"
"Pittsburgh","CRAFTON MEDICAL CENTER",87,0.995,5,214,215,0,0,47440.9517,"1 Walsh Road","TRUE PERFORMANCE AHN","Y"
"Pittsburgh","GREEN TREE MEDICAL ASSOCIATES",83,0.996,5,255,256,0,0,51163.5572,"651 Holiday Drive","TRUE PERFORMANCE AHN","Y"
"Pittsburgh","PRIMARY CARE NORTHSIDE",87,0.995,5,221,222,0,0,35830.6454,"490 East North Avenue","TRUE PERFORMANCE AHN","Y"
"Pittsburgh","WEXFORD MEDICAL PRACTICE",1,1,5,246,246,0,0,70890.1741,"1130 Perry Highway","TRUE PERFORMANCE AHN","Y"
"Pittsburgh","POLINSKI MEDICAL ASSOCIATES",1,1,5,83,83,0,0,55733.5687,"526 Perry Highway","TRUE PERFORMANCE AHN","Y"
"Pittsburgh","BONACORSI BROWN AND JOHNSON PRIMARY CARE",1,1,5,214,214,0,0,48409.2639,"3005 Banksville Road","TRUE PERFORMANCE AHN","Y"
"Pittsburgh","CARDIOVASCULAR AND CRITICAL CARE ASSOCIATES",1,1,5,19,19,0,0,30284.2042,"4815 Liberty Avenue","","Y"
"Pittsburgh","NORTH HILLS INTERNAL MEDICINE",1,1,5,223,223,0,0,70890.1741,"9335 McKnight Road","TRUE PERFORMANCE AHN","Y"
"Pittsburgh","PULMONARY PARTNERS UPMC",1,1,5,8,8,NA,NA,70890.1741,"9104 Babcock Boulevard","","Y"
"Pittsburgh","AHN STONE QUARRY",1,1,5,82,82,0,0,70890.1741,"811 Camp Horne Road","TRUE PERFORMANCE AHN","Y"
"Pittsburgh","SOUTH END PRIMARY HEALTH CARE PC",144,0.75,2,6,8,NA,NA,39540.609,"2100 Jane Street","","Y"
"Pittsburgh","AHN SQUIRREL HILL PRIMARY CARE",1,1,5,47,47,0,0,59637.4129,"5889 Forbes Avenue","TRUE PERFORMANCE AHN","Y"
"Pittsburgh","DRS KNUPP AND RECALDE UPMC",1,1,5,44,44,0,0,59637.4129,"4381 Murray Avenue","","Y"
"Pittsburgh","GOBAO INTERNAL MEDICINE",117,0.971,4,33,34,0,1,78579.877,"1145 Bower Hill Road","TRUE PERFORMANCE PLUS COMM","Y"
"Pittsburgh","PINNACLE INTERNAL MEDICINE UPMC",111,0.981,5,53,54,0,0,45928.1315,"532 South Aiken Avenue","","Y"
"Pittsburgh","PPCP BHAVANK DOSHI MD",1,1,5,40,40,0,0,39540.609,"2100 Jane Street","TRUE PERFORMANCE PLUS COMM","Y"
"Pittsburgh","THE CENTER FOR COMPLEMENTARY AND INTEGRATIVE HEALTH",1,1,5,3,3,NA,NA,45961.4011,"100 South Jackson Avenue","","Y"
"Pittsburgh","PRIVATE PHYSICIANS MEDICAL PRACTICE LLC",1,1,5,40,40,0,0,70890.1741,"5700 Corporate Drive","TRUE PERFORMANCE","Y"
"Pittston","GMG PITTSTON FP",1,1,5,10,10,0,0,43425.8968,"42 North Main St","TRUE PERFORMANCE CUSTOM CONTRACT","Y"
"Plains","PAUL J WITT MD PC",1,0.5,1,2,4,NA,NA,40667.5434,"59 East Carey Street","","Y"
"Plymouth Meeting","SUBURBAN GERIATRICS INC",1,0.889,3,8,9,NA,NA,75489.8161,"2901 Jolly Road","","Y"
"Point Pleasant","POINT PLEASANT PHYSICIAN BILLING SERVICE",1,1,5,8,8,NA,NA,38731.8194,"2520 Valley Drive","TRUE PERFORMANCE","Y"
"Point Pleasant","JAMES P WAGNER DO",2,0.75,2,3,4,NA,NA,38731.8194,"708 Viand Street","","Y"
"Port Allegany","UPPER ALLEGANY MEDICAL CENTER",2,0.6,1,3,5,NA,NA,40683.8208,"1 Willow Street","","Y"
"Port Allegany","PORT HEALTH CENTER",1,0.975,4,39,40,0,1,40683.8208,"45 Pine Street","TRUE PERFORMANCE","Y"
"Port Carbon","SOPHY, MATTHEW C, DO",1,1,5,6,6,NA,NA,41989.5803,"73 Coal Street","TRUE PERFORMANCE","Y"
"Port Matilda","GMG GRAYS WOODS",1,1,5,128,128,0,0,69287.3994,"132 Abigail Lane","TRUE PERFORMANCE CUSTOM CONTRACT","Y"
"Portage","PORTAGE HEALTH CENTER",1,0.986,5,73,74,0,0,39360.4418,"3670 Portage Street","TRUE PERFORMANCE PLUS COMM","Y"
"Pottsville","INTEGRATED MEDICAL GROUP INT MED",4,0.973,4,71,73,0,1,39292.0361,"48 Tunnel Road","TRUE PERFORMANCE","Y"
"Pottsville","LEHIGH VALLEY PHYSICIANS GROUP INC",3,0.988,5,81,82,0,0,39292.0361,"205 East Laurel Boulevard","TRUE PERFORMANCE","Y"
